<?xml version="1.0" encoding="UTF-8"?>
<xs:schema xmlns:xs="http://www.w3.org/2001/XMLSchema">

    <xs:element name="nodes">
        <xs:complexType>
            <xs:sequence maxOccurs="unbounded" minOccurs="0">
                <xs:element ref="node"/>
            </xs:sequence>
        </xs:complexType>
    </xs:element>
    <xs:element name="node">
        <xs:complexType>
            <xs:choice maxOccurs="unbounded" minOccurs="0">
                <xs:element ref="node"/>
                <xs:element ref="question"/>
            </xs:choice>
            <xs:attribute name="value" type="xs:string"/>
            <xs:attribute name="application">
                <xs:simpleType>
                    <xs:restriction base="xs:token">
                        <xs:enumeration value="TM"/>
                        <xs:enumeration value="GMM"/>
                        <xs:enumeration value="BOTH"/>
                    </xs:restriction>
                </xs:simpleType>
            </xs:attribute>
        </xs:complexType>
    </xs:element>
    <xs:element name="question">
        <xs:complexType>
            <xs:attribute name="value" type="xs:string"/>
        </xs:complexType>
    </xs:element>
</xs:schema>
